{
  "schema_version": "steam-agent-eval/0.2", "id": "m5-c02", "status": "active", "milestone": "M5", "scenario_kind": "contract",
  "question_family": "minimum requirements", "tags": ["cpu", "gpu", "unknown"], "frozen_time": "2030-01-15T12:00:00Z",
  "fixture": {"kind": "synthetic_normalized", "description": "RAM, storage, and architecture compare exactly but CPU and GPU names are opaque.", "facts": [{"subject": "synthetic:appid:5201", "state": "opaque_cpu_gpu"}]},
  "conversation": {"user": ["Using the US store and English metadata, does my PC meet AppID 5201's minimum requirements?"], "paraphrase": "Do not order marketing model names."},
  "tool_policy": {"allowed": ["steam-agent compatibility assess"], "required": [{"command": "steam-agent compatibility assess", "arguments": ["5201", "--account", "synthetic", "--target", "machine:synthetic-machine", "--country", "US", "--language", "english"]}], "prohibited": ["sync", "CPU name ordering", "GPU name ordering"]},
  "deterministic_oracle": {"recipe_or_contract": "compatibility/0.1 minimum comparison", "assertions": [{"path": "$.data.results[0].compatibility", "operator": "equals", "expected": "unknown"}, {"path": "$.data.results[0].unknowns", "operator": "contains", "expected": "meets_minimum"}, {"path": "$.data.results[0].unknowns", "operator": "omits", "expected": "architecture"}]},
  "fact_rubric": {"grading": "deterministic", "required_claim_paths": ["$.data.results[0].compatibility", "$.data.results[0].unknowns[2]"], "criteria": [{"id": "opaque-models", "weight": 10, "requirement": "Leave opaque CPU and GPU comparisons unknown.", "hard_fail": true}]},
  "judged_answer_rubric": {"grading": "model_or_human", "status": "opt_in", "criteria": [{"id": "explain-gap", "weight": 3, "requirement": "Explain which minimum evidence cannot be compared."}]},
  "privacy_canaries": {"steam_id64": "EVAL_CANARY_STEAMID64_C02", "credential": "EVAL_CANARY_CREDENTIAL_C02", "local_path": "EVAL_CANARY_LOCAL_PATH_C02"}
}
