{
  "schema_version": "steam-agent-eval/0.2", "id": "m6-g03", "status": "active", "milestone": "M6", "scenario_kind": "contract",
  "question_family": "group fit ranking", "tags": ["group", "ranking", "player-count"], "frozen_time": "2030-01-15T12:00:00Z",
  "fixture": {"kind": "synthetic_normalized", "description": "Three declared online co-op candidates differ by asserted copies and by the declared player ceiling for a two-person group.", "facts": [{"subject": "synthetic:appid:6301", "state": "group_declared_all_own", "detail": "mode=online_co_op; players_min=2; players_max=4"}, {"subject": "synthetic:appid:6302", "state": "group_declared_first_owner_only", "detail": "mode=online_co_op; players_min=2; players_max=4"}, {"subject": "synthetic:appid:6303", "state": "group_declared_all_own", "detail": "mode=online_co_op; players_min=1; players_max=1"}]},
  "conversation": {"user": ["Using US and English metadata, rank AppIDs 6301, 6302, and 6303 for online co-op by synthetic:alpha and synthetic:beta with the fewest extra purchases."], "paraphrase": "Rank by shared copy certainty and keep the single-player ceiling out of the group answer."},
  "tool_policy": {"allowed": ["steam-agent group recommend"], "required": [{"command": "steam-agent group recommend", "arguments": ["--scope", "appids", "--limit", "20", "--appid", "6301", "--appid", "6302", "--appid", "6303", "--member", "synthetic:alpha", "--member", "synthetic:beta", "--context-account", "synthetic", "--context-machine", "synthetic-machine", "--country", "US", "--language", "english", "--mode", "online_coop", "--objective", "min-copies", "--include-member-evidence"]}], "prohibited": ["sync", "provider request", "alias disclosure"]},
  "deterministic_oracle": {"recipe_or_contract": "group-fit/0.2", "assertions": [{"path": "$.data.schema", "operator": "equals", "expected": "group-fit/0.2"}, {"path": "$.data.results[*].appid", "operator": "ordered_equals", "expected": [6301, 6302]}, {"path": "$.data.results[0].copies.guarantee", "operator": "equals", "expected": "guaranteed"}, {"path": "$.data.results[1].copies.guarantee", "operator": "equals", "expected": "conditional"}, {"path": "$.data.candidate_count", "operator": "equals", "expected": 3}, {"path": "$.data.eligible_ranked_count", "operator": "equals", "expected": 2}]},
  "fact_rubric": {"grading": "deterministic", "required_claim_paths": ["$.data.results[*].appid", "$.data.results[0].copies.guarantee", "$.data.results[1].copies.guarantee", "$.data.candidate_count"], "criteria": [{"id": "copy-certainty-order", "weight": 8, "requirement": "Rank the guaranteed shared copy above the conditional one.", "hard_fail": true}, {"id": "player-ceiling-gate", "weight": 6, "requirement": "Drop the candidate whose declared player ceiling cannot seat the group.", "hard_fail": true}]},
  "judged_answer_rubric": {"grading": "model_or_human", "status": "opt_in", "criteria": [{"id": "explain-conditional", "weight": 3, "requirement": "Say why the second candidate is conditional rather than confirmed."}]},
  "privacy_canaries": {"steam_id64": "EVAL_CANARY_STEAMID64_M6G03", "credential": "EVAL_CANARY_CREDENTIAL_M6G03", "local_path": "EVAL_CANARY_LOCAL_PATH_M6G03"}
}
