{
  "schema_version": "steam-agent-eval/0.2", "id": "m3-d04", "status": "active", "milestone": "M3", "scenario_kind": "contract",
  "question_family": "provider fallback", "tags": ["attribution", "fallback", "identity"], "frozen_time": "2030-01-15T12:00:00Z",
  "fixture": {"kind": "synthetic_normalized", "description": "Exact primary lookup misses and normalized-game USD fallback supplies a current offer.", "facts": [
    {"subject": "synthetic:appid:401", "state": "gg_not_found"}, {"subject": "synthetic:appid:401", "state": "cheapshark_ready", "detail": "amount=799; store_class=unknown; comparability=normalized_game"}
  ]},
  "conversation": {"user": ["Can another provider price this US wishlist game when the primary source cannot?"], "paraphrase": "Use the fallback price evidence for this wishlist game."},
  "tool_policy": {"allowed": ["steam-agent deals query"], "required": [{"command": "steam-agent deals query", "arguments": ["--scope", "wishlist", "--account", "synthetic-primary", "--country", "US", "--store-class", "unknown"]}], "prohibited": ["sync", "browser", "exact-product-relabel"]},
  "deterministic_oracle": {"recipe_or_contract": "M3 provider ladder", "assertions": [
    {"path": "$.data.items[0].deal.fallback_rung", "operator": "equals", "expected": 1},
    {"path": "$.data.items[0].deal.current_offer.provider", "operator": "equals", "expected": "cheapshark"},
    {"path": "$.data.items[0].deal.current_offer.product.comparability", "operator": "equals", "expected": "normalized_game"}
  ]},
  "fact_rubric": {"grading": "deterministic", "required_claim_paths": ["$.data.items[0].deal.fallback_rung", "$.data.items[0].deal.current_offer.provider", "$.data.items[0].deal.current_offer.product.comparability", "$.data.items[0].deal.current_offer.store_class", "$.data.items[0].deal.current_offer.price.currency"], "criteria": [
    {"id": "fallback-attribution", "weight": 5, "requirement": "Attribute the fallback provider and preserve its identity grade.", "hard_fail": true},
    {"id": "store-limitation", "weight": 5, "requirement": "Preserve unknown-store and USD-only limitations."}
  ]},
  "judged_answer_rubric": {"grading": "model_or_human", "status": "opt_in", "criteria": [{"id": "tradeoff-clarity", "weight": 2, "requirement": "Explain why fallback evidence is less exact."}]},
  "privacy_canaries": {"steam_id64": "EVAL_CANARY_STEAMID64_D04", "credential": "EVAL_CANARY_CREDENTIAL_D04", "local_path": "EVAL_CANARY_LOCAL_PATH_D04"}
}
