{
  "schema_version": "steam-agent-eval/0.2", "id": "m4-w01", "status": "active", "milestone": "M4", "scenario_kind": "contract",
  "question_family": "wishlist purchase fit", "tags": ["deal", "recipe", "unknown", "wishlist"], "frozen_time": "2030-01-15T12:00:00Z",
  "fixture": {"kind": "synthetic_normalized", "description": "A complete wishlist snapshot has two candidates and no price, review, preference, or compatibility evidence at all.", "facts": [{"subject": "synthetic:appid:1801", "state": "wishlisted_without_deal_evidence"}, {"subject": "synthetic:appid:1802", "state": "wishlisted_without_deal_evidence"}]},
  "conversation": {"user": ["Anything on my wishlist worth buying right now?"], "paraphrase": "Without price or review evidence a purchase recommendation is not supported."},
  "tool_policy": {"allowed": ["steam-agent recommendations wishlist"], "required": [{"command": "steam-agent recommendations wishlist", "arguments": ["--account", "synthetic", "--country", "US"]}], "prohibited": ["sync", "price inference", "provider request"]},
  "deterministic_oracle": {"recipe_or_contract": "wishlist-fit/0.1", "assertions": [{"path": "$.data.recipe", "operator": "equals", "expected": "wishlist-fit/0.1"}, {"path": "$.data.ranked[*].appid", "operator": "ordered_equals", "expected": [1801, 1802]}, {"path": "$.data.purchase_recommendation_supported", "operator": "equals", "expected": false}, {"path": "$.data.ranked[0].deal_value.state", "operator": "equals", "expected": "unknown"}, {"path": "$.data.ranked[0].tradeoffs", "operator": "contains", "expected": "no_deal_evidence"}, {"path": "$.completeness.missing_capabilities", "operator": "contains", "expected": "prices.wishlist.read"}]},
  "fact_rubric": {"grading": "deterministic", "required_claim_paths": ["$.data.ranked[*].appid", "$.data.purchase_recommendation_supported", "$.data.ranked[*].deal_value.state", "$.data.ranked[*].review", "$.data.ranked[*].release.state", "$.data.ranked[*].compatibility.state"], "criteria": [{"id": "no-unsupported-purchase-advice", "weight": 10, "requirement": "Keep the deal, review, release, and compatibility dimensions separate and do not recommend a purchase the evidence cannot support.", "hard_fail": true}]},
  "judged_answer_rubric": {"grading": "model_or_human", "status": "opt_in", "criteria": [{"id": "name-missing-price", "weight": 5, "requirement": "Say that no price or review evidence is cached and name the explicit sync that would collect it."}]},
  "privacy_canaries": {"steam_id64": "EVAL_CANARY_STEAMID64_M4W01", "credential": "EVAL_CANARY_CREDENTIAL_M4W01", "local_path": "EVAL_CANARY_LOCAL_PATH_M4W01"}
}
