{
  "schema_version": "steam-agent-eval/0.2", "id": "m5-c07", "status": "active", "milestone": "M5", "scenario_kind": "contract",
  "question_family": "compatibility override", "tags": ["override", "reproducibility", "three-valued"], "frozen_time": "2030-01-15T12:00:00Z",
  "fixture": {"kind": "synthetic_normalized", "description": "Minimum compatibility is unknown until a named one-query caller override.", "facts": [{"subject": "synthetic:appid:5701", "state": "minimum_unknown_with_override"}]},
  "conversation": {"user": ["For this check, assume I accept the unknown requirement risk."], "paraphrase": "Apply a traceable query-only override."},
  "tool_policy": {"allowed": ["steam-agent compatibility assess"], "required": [{"command": "steam-agent compatibility assess", "arguments": ["5701", "--account", "synthetic", "--target", "machine:synthetic-machine", "--country", "US", "--language", "english", "--override", "5701:minimum-risk:meets_minimum=pass", "--explain"]}], "prohibited": ["sync", "persist override", "rewrite evidence"]},
  "deterministic_oracle": {"recipe_or_contract": "compatibility/0.1 named override", "assertions": [{"path": "$.data.results[0].gates[3].original", "operator": "equals", "expected": "unknown"}, {"path": "$.data.results[0].gates[3].effective", "operator": "equals", "expected": "pass"}, {"path": "$.data.results[0].gates[3].override_name", "operator": "equals", "expected": "minimum-risk"}]},
  "fact_rubric": {"grading": "deterministic", "required_claim_paths": ["$.data.results[0].gates[3].original", "$.data.results[0].gates[3].effective", "$.data.results[0].gates[3].override_name"], "criteria": [{"id": "override-lineage", "weight": 10, "requirement": "Retain original and effective states plus override identity.", "hard_fail": true}]},
  "judged_answer_rubric": {"grading": "model_or_human", "status": "opt_in", "criteria": [{"id": "temporary", "weight": 3, "requirement": "Explain that the assumption is temporary."}]},
  "privacy_canaries": {"steam_id64": "EVAL_CANARY_STEAMID64_C07", "credential": "EVAL_CANARY_CREDENTIAL_C07", "local_path": "EVAL_CANARY_LOCAL_PATH_C07"}
}
