{
  "schema_version": "steam-agent-eval/0.2", "id": "m4-p01", "status": "active", "milestone": "M4", "scenario_kind": "contract",
  "question_family": "never played backlog", "tags": ["backlog", "lower-bound", "owned", "playtime", "unknown"], "frozen_time": "2030-01-15T12:00:00Z",
  "fixture": {"kind": "synthetic_normalized", "description": "An authoritative visible-owned snapshot records a zero, a positive, and an absent lifetime playtime, plus one zero whose newer activity evidence proves it was played.", "facts": [{"subject": "synthetic:appid:1901", "state": "owned_never_played"}, {"subject": "synthetic:appid:1902", "state": "owned_recorded_positive_minutes"}, {"subject": "synthetic:appid:1903", "state": "owned_playtime_field_absent"}, {"subject": "synthetic:appid:1904", "state": "owned_zero_minutes_activity_newer_positive"}]},
  "conversation": {"user": ["Which games that I own have I never actually played?"], "paraphrase": "A never-played list is a filter over recorded minutes, and it is a lower bound, not a complete backlog."},
  "tool_policy": {"allowed": ["steam-agent games query"], "required": [{"command": "steam-agent games query", "arguments": ["--scope", "owned", "--account", "synthetic", "--playtime", "zero"]}], "prohibited": ["sync", "provider request", "absence-as-zero"]},
  "deterministic_oracle": {"recipe_or_contract": "owned playtime truth state and zero filter", "assertions": [{"path": "$.context.playtime_filter", "operator": "equals", "expected": "zero"}, {"path": "$.data.items[*].appid", "operator": "ordered_equals", "expected": [1901]}, {"path": "$.data.items[0].playtime_state", "operator": "equals", "expected": "zero"}, {"path": "$.data.items[0].playtime_reason", "operator": "equals", "expected": "owned_zero_minutes"}, {"path": "$.data.playtime_state_counts.zero", "operator": "equals", "expected": 1}, {"path": "$.data.playtime_state_counts.positive", "operator": "equals", "expected": 2}, {"path": "$.data.playtime_state_counts.unknown", "operator": "equals", "expected": 1}, {"path": "$.data.limitations", "operator": "contains", "expected": "never_played_list_is_a_lower_bound"}, {"path": "$.data.limitations", "operator": "contains", "expected": "zero_recorded_minutes_is_not_proof_of_never_launched"}, {"path": "$.data.limitations", "operator": "contains", "expected": "individually_private_games_may_be_omitted"}, {"path": "$.completeness.status", "operator": "equals", "expected": "complete"}]},
  "fact_rubric": {"grading": "deterministic", "required_claim_paths": ["$.data.items[*].appid", "$.data.items[0].playtime_state", "$.data.playtime_state_counts.positive", "$.data.playtime_state_counts.unknown", "$.data.limitations[3]", "$.data.limitations[4]"], "criteria": [{"id": "absent-minutes-are-not-zero", "weight": 10, "requirement": "List only the title with recorded zero minutes; never present an absent playtime field or an activity-upgraded title as never played.", "hard_fail": true}]},
  "judged_answer_rubric": {"grading": "model_or_human", "status": "opt_in", "criteria": [{"id": "state-the-lower-bound", "weight": 5, "requirement": "Say the list is a lower bound because unknown-playtime titles were excluded and zero recorded minutes is not proof a game was never launched."}]},
  "privacy_canaries": {"steam_id64": "EVAL_CANARY_STEAMID64_M4P01", "credential": "EVAL_CANARY_CREDENTIAL_M4P01", "local_path": "EVAL_CANARY_LOCAL_PATH_M4P01"}
}
