{
  "schema_version": "steam-agent-eval/0.2", "id": "m6-g02", "status": "active", "milestone": "M6", "scenario_kind": "contract",
  "question_family": "group eligibility", "tags": ["group", "kleene", "unknown"], "frozen_time": "2030-01-15T12:00:00Z",
  "fixture": {"kind": "synthetic_normalized", "description": "Only the first member has asserted a copy; the second member has a profile but no ownership assertion at all.", "facts": [{"subject": "synthetic:appid:6201", "state": "group_declared_first_owner_only", "detail": "mode=online_co_op; players_min=2; players_max=4"}]},
  "conversation": {"user": ["Does the other person already own this, or do they need to buy it?"], "paraphrase": "An absent ownership assertion is unknown, never a not-owned claim."},
  "tool_policy": {"allowed": ["steam-agent group eligibility"], "required": [{"command": "steam-agent group eligibility", "arguments": ["6201", "--member", "synthetic:alpha", "--member", "synthetic:beta", "--account", "synthetic", "--machine", "synthetic-machine", "--country", "US", "--language", "english", "--mode", "online_coop"]}], "prohibited": ["sync", "absence-as-false", "provider request"]},
  "deterministic_oracle": {"recipe_or_contract": "group-eligibility/0.2 three-valued ownership", "assertions": [{"path": "$.data.results[0].ownership.members[1].state", "operator": "equals", "expected": "unknown"}, {"path": "$.data.results[0].ownership.intersection", "operator": "equals", "expected": "unknown"}, {"path": "$.data.results[0].ownership.union", "operator": "equals", "expected": "owned"}, {"path": "$.data.results[0].copies.guarantee", "operator": "equals", "expected": "conditional"}, {"path": "$.data.results[0].copies.missing.maximum", "operator": "equals", "expected": 1}]},
  "fact_rubric": {"grading": "deterministic", "criteria": [{"id": "unknown-not-false", "weight": 10, "requirement": "Keep the unasserted member's ownership unknown and report a copy range, not a purchase requirement.", "hard_fail": true}]},
  "judged_answer_rubric": {"grading": "model_or_human", "status": "opt_in", "criteria": [{"id": "range-honesty", "weight": 4, "requirement": "State that between zero and one extra copy may be needed and say how to resolve it."}]},
  "privacy_canaries": {"steam_id64": "EVAL_CANARY_STEAMID64_M6G02", "credential": "EVAL_CANARY_CREDENTIAL_M6G02", "local_path": "EVAL_CANARY_LOCAL_PATH_M6G02"}
}
