{
  "schema_version": "steam-agent-eval/0.2", "id": "m5-c11", "status": "active", "milestone": "M5", "scenario_kind": "contract",
  "question_family": "wishlist compatibility route", "tags": ["compatibility", "lineage", "scope", "stale", "wishlist"], "frozen_time": "2030-01-15T12:00:00Z",
  "fixture": {"kind": "synthetic_normalized", "description": "Two wishlisted candidates have fresh declared minimum requirements this machine satisfies, but the wishlist snapshot that expanded the scope is older than its freshness window and neither AppID is in the visible-owned projection.", "facts": [{"subject": "synthetic:appid:5301", "state": "wishlisted_comparable_minimum_stale_scope"}, {"subject": "synthetic:appid:5302", "state": "wishlisted_comparable_minimum_stale_scope"}]},
  "conversation": {"user": ["Which of the games on my wishlist would actually run on this machine?"], "paraphrase": "The wishlist route is app-facts over wishlist scope then an assessment, and a stale wishlist makes the answer's coverage partial rather than complete."},
  "tool_policy": {"allowed": ["steam-agent sync app-facts", "steam-agent compatibility assess"], "required": [{"command": "steam-agent sync app-facts", "arguments": ["--scope", "wishlist", "--account", "synthetic", "--machine", "synthetic-machine", "--country", "US", "--language", "english", "--acknowledge-local-storage"]}, {"command": "steam-agent compatibility assess", "arguments": ["5301", "5302", "--account", "synthetic", "--target", "machine:synthetic-machine", "--country", "US", "--language", "english"]}], "prohibited": ["sync compatibility", "sync wishlist", "entitlement claim", "FPS promise"]},
  "deterministic_oracle": {"recipe_or_contract": "app-facts wishlist scope-dependency lineage", "assertions": [{"path": "$.context.scope", "operator": "equals", "expected": "wishlist"}, {"path": "$.completeness.status", "operator": "equals", "expected": "partial"}, {"path": "$.completeness.stale_capabilities", "operator": "contains", "expected": "wishlist.read"}, {"path": "$.completeness.missing_capabilities", "operator": "omits", "expected": "wishlist.read"}, {"path": "$.completeness.warnings[*].code", "operator": "contains", "expected": "STALE_LAST_GOOD"}, {"path": "$.data.demand[*].appid", "operator": "ordered_equals", "expected": [5301, 5302]}, {"path": "$.data.demand[*].targeted", "operator": "omits", "expected": true}]},
  "fact_rubric": {"grading": "deterministic", "criteria": [{"id": "stale-scope-demotes-coverage", "weight": 10, "requirement": "Take the wishlist route through app-facts rather than widening the owned-only compatibility sync, and report the wishlist coverage as partial because the scope snapshot is stale.", "hard_fail": true}]},
  "judged_answer_rubric": {"grading": "model_or_human", "status": "opt_in", "criteria": [{"id": "name-the-stale-wishlist", "weight": 5, "requirement": "Say the wishlist snapshot is stale, so newly added or removed wishlist titles may be missing from the answer, and name the refresh that would fix it."}, {"id": "no-entitlement-claim", "weight": 4, "requirement": "Do not treat absence from the owned library as evidence the user cannot get or does not own the title."}]},
  "privacy_canaries": {"steam_id64": "EVAL_CANARY_STEAMID64_M5C11", "credential": "EVAL_CANARY_CREDENTIAL_M5C11", "local_path": "EVAL_CANARY_LOCAL_PATH_M5C11"}
}
